[
  {
    "id": 1,
    "title": "AI Pairing Partner for Exploring Approaches",
    "status": "PASS",
    "severity": "None",
    "evidence": "`specs/001-rc4-release-audit/research.md` records explicit alternatives and rationales for the bounded 126-item catalog, five-package first wave, npm bootstrap ordering, and separation of evidence collection from irreversible publication.",
    "action": "No further approach exploration is needed for this audit; preserve these recorded decisions unless release scope changes."
  },
  {
    "id": 2,
    "title": "Analyze API Contracts and Integrations",
    "status": "FINDING",
    "severity": "Important",
    "evidence": "The new public `TenantAdapterEventInput` requires `identity` at `packages/server/src/tenant-adapter.ts:24`, but `TenantAdapter.build()` constructs the event from `input.payload ?? {}` at line 85 and never reads `input.identity`. The existing test fixture supplies `identity.payload.ft_source = \"google\"` at `packages/server/tests/tenant-adapter.test.ts:20` but does not assert it. Runtime reproduction with the built ESM returned `{\"ft_source\":null,\"visitor_id\":null,\"session_id\":null,\"session_number\":null,\"event_name\":\"lead_created\"}` for an input identity containing all four values.",
    "action": "Build from `input.identity.payload` and copy visitor/session fields using the established `ClickTrailServer` contract, or remove `identity` and document a deliberate replacement. Add an executable regression test for attribution and identity preservation."
  },
  {
    "id": 3,
    "title": "Analyze Database Schema and Relationships",
    "status": "N/A",
    "severity": "None",
    "evidence": "`specs/001-rc4-release-audit/plan.md` identifies storage as repository files, Git objects, GitHub, and npm metadata and states there is no application database. A targeted `find` found no `*.prisma`, `*schema.sql`, or `migrations/` files outside dependency trees.",
    "action": "No database-schema review applies to this TypeScript library release."
  },
  {
    "id": 4,
    "title": "Analyze Security Scan Results",
    "status": "FINDING",
    "severity": "Important",
    "evidence": "Local `pnpm audit --prod --audit-level high` exited 0, and `.github/workflows/{codeql,osv,security}.yml` define CodeQL, OSV, and zizmor scans. However, `git status --porcelain=v1` shows 63 tracked modifications plus untracked release/runtime files while `HEAD` is still `origin/master` (`484e93a`), so those remote scanners have not analyzed the actual RC4 diff.",
    "action": "Do not tag from the working tree. Commit the complete reviewed scope to the release branch, open the PR, and require current CodeQL, OSV, and zizmor results to pass for that exact commit."
  },
  {
    "id": 5,
    "title": "Analyze Stack Trace",
    "status": "N/A",
    "severity": "None",
    "evidence": "A targeted repository scan found no stored JavaScript/Python stack trace artifact outside dependency trees. Current `pnpm typecheck`, `pnpm test`, `pnpm build`, and `pnpm probe` all exited 0, so there is no failing runtime trace to analyze.",
    "action": "No stack-trace diagnosis applies unless a failing job or reproducible trace is supplied."
  },
  {
    "id": 6,
    "title": "Architecture Design Discussion",
    "status": "PASS",
    "severity": "None",
    "evidence": "`docs/ARCHITECTURE.md` defines deterministic core/effect-adapter boundaries and stable versus incubating entry points. `docs/EVENT-CONTRACT.md` defines canonical events, trusted tenant configuration, and stable idempotency keys; the new tenant adapter keeps tenant/site/adapter metadata in server config and canonicalizes event names. `pnpm typecheck`, tests, and build all pass.",
    "action": "Retain the documented package boundaries; resolve the separate API and ID findings before release."
  },
  {
    "id": 7,
    "title": "Assess MR Test Coverage",
    "status": "FINDING",
    "severity": "Important",
    "evidence": "The full `pnpm test` suite passes, but `packages/server/tests/tenant-adapter.test.ts:20` deliberately supplies `identity.payload.ft_source = \"google\"` without asserting attribution or visitor/session propagation. `packages/server/src/tenant-adapter.ts:85` instead reads the separate optional `input.payload`, and the runtime reproduction proves the required identity is silently dropped.",
    "action": "Add regression coverage that asserts `ft_source`, `visitor_id`, `session_id`, and `session_number` survive `TenantAdapter.build()` and `send()`. Make that test fail before fixing the implementation."
  },
  {
    "id": 8,
    "title": "Assess Third-Party Dependency Risks",
    "status": "FINDING",
    "severity": "Minor",
    "evidence": "`pnpm audit --prod --json` reports 1 low, 0 moderate, 0 high, and 0 critical vulnerabilities across 941 dependencies: advisory 1103907, `cookie` 0.6.0 accepting out-of-bounds cookie name/path/domain characters, via `integrations/sveltekit > @sveltejs/kit > cookie`; patched in `cookie >=0.7.0`. GitHub Actions dependencies are commit-SHA pinned.",
    "action": "Update the compatible SvelteKit dependency chain so it resolves `cookie >=0.7.0`, or document bounded acceptance of this low advisory for RC4; rerun the production audit."
  },
  {
    "id": 9,
    "title": "Audit Codebase for Compliance",
    "status": "FINDING",
    "severity": "Critical",
    "evidence": "`docs/internal/FIRST-PUBLICATION-CHECKLIST.md:16-19` leaves the copyright-holder decision and B1-B3 provenance attestations unchecked, and line 25 explicitly leaves license/provenance approval open and required before npm publication. `docs/internal/RELEASE-READINESS-REVIEW.md` likewise marks `GOV-001` open, and the release constitution makes unresolved ownership/licensing/provenance a release blocker.",
    "action": "Do not create or push the RC4 tag and do not publish. Hugo must decide the copyright holder, align LICENSE/package metadata, approve the required attestations verbatim, and close GOV-001 with recorded evidence."
  },
  {
    "id": 10,
    "title": "Automate Repetitive Development Tasks",
    "status": "FINDING",
    "severity": "Critical",
    "evidence": "`tools/release/bootstrap-new-packages.sh:7-14` directly publishes core, browser, Astro, and Nuxt using each current manifest version, which is `0.1.0-rc.4`. After bootstrap, `.github/workflows/publish.yml` attempts to publish the same four immutable `0.1.0-rc.4` versions again in its five-package wave. npm will reject already-published versions, so the documented bootstrap-then-tag flow cannot complete. The script also has no build/package-content preflight, while all `dist/` paths are gitignored and absent from `git ls-files`.",
    "action": "Replace the bootstrap with a reviewed, built bootstrap-only prerelease version distinct from RC4 (then configure trusted publishers), or redesign the workflow with an explicitly reviewed immutable-version strategy. Add build, tarball allowlist, and clean-room checks before any one-time publish."
  },
  {
    "id": 11,
    "title": "Break Down Epic into Issues",
    "status": "N/A",
    "severity": "None",
    "evidence": "The origin remote is GitHub (`https://github.com/vizuh/clicktrail-js.git`), and the final observed tree contains a bounded RC4 release specification/plan rather than a GitLab Epic or Epic identifier. No epic was supplied for decomposition.",
    "action": "Do not manufacture GitLab issues for this release audit; use the existing release specification and review gates."
  },
  {
    "id": 12,
    "title": "Build Full-Stack Application",
    "status": "N/A",
    "severity": "None",
    "evidence": "`specs/001-rc4-release-audit/plan.md` classifies the project as a multi-package library and integration monorepo with no application database. The current diff changes SDK packages, adapters, docs, CI, and release tooling rather than requesting a full-stack application build.",
    "action": "No full-stack application work is in RC4 scope."
  },
  {
    "id": 13,
    "title": "Categorize Features",
    "status": "PASS",
    "severity": "None",
    "evidence": "`README.md` categorizes public entry points as Stable, Stable adapter, or Incubating and separately lists each package/integration with its support boundary. `site/src/data/integrations.ts` and the updated package table include Formbricks and the split core/browser/server/consent surfaces.",
    "action": "Keep stability and package categories aligned with exports and publication scope as RC4 changes are finalized."
  },
  {
    "id": 14,
    "title": "Check MR Against Coding Standards",
    "status": "PASS",
    "severity": "None",
    "evidence": "Against the uncommitted diff, `git diff --check`, `pnpm typecheck`, `pnpm test`, `pnpm build`, and `pnpm probe` all exited 0; the browser probe passed 12/12 fixtures. Changed branching/security paths include focused Vitest tests in browser, Directus, integration proxy, server, and Formbricks areas.",
    "action": "No formatting/type/build standards fix is required; logical and release-process findings remain separate blockers."
  },
  {
    "id": 15,
    "title": "Code Review Discussion",
    "status": "FINDING",
    "severity": "Important",
    "evidence": "`packages/core/src/ids.ts:19-38` derives stable event IDs with a 32-bit FNV-1a digest (`evt_s-` plus 8 hex digits). The new tenant adapter uses this ID for collector deduplication. Executable reproduction found distinct external IDs `xXQY9Q9m8YsVb0LI` and `GSpqZXJtjd9IBZ6f` under the same site/tenant/adapter/event that both produce `evt_s-690beb83`; a collector following the documented duplicate-as-success rule can silently discard a real event.",
    "action": "Use a collision-resistant stable identifier (for example, a versioned 128-bit-or-longer digest/UUIDv5-equivalent) and add the reproduced collision as a regression test. Record compatibility implications because event IDs are a public contract."
  },
  {
    "id": 16,